{
  "id": "01JZ7F3E6F7G8H9I0J1K2L3M4N",
  "hash": "sha256:9f86d081884c7d659a2feaa0c55ad015a3bf4f1b2b0b822cd15d6c15b0f00a08",
  "sizeBytes": 204800,
  "mimeType": "application/pdf",
  "filename": "student-work.pdf",
  "description": "Scanned copy of student assignment 7.",
  "createdAt": "2026-08-28T09:12:00Z"
}
